{
  "$schema": "./baseline.schema.json",
  "schemaVersion": 1,
  "tool": "theme-doctor",
  "sourceCommit": "695c1868882bbf3ca235e4f84e408866175cd6f4",
  "checks": {
    "color-leaks": {
      "measurementVersion": 1,
      "observedStatus": "fail",
      "dimensions": {
        "violations": {
          "direction": "lower-is-better",
          "value": 30,
          "items": [
            {
              "key": "[\"apps/mfe-audit/src/app/components/DeliveryStatusPill.tsx\",\"inline-rgb\",\"border:'rgba(148,163,184,0.5)\"]",
              "count": 1
            },
            {
              "key": "[\"apps/mfe-audit/src/app/components/DeliveryStatusPill.tsx\",\"inline-rgb\",\"border:'rgba(239,68,68,0.4)\"]",
              "count": 1
            },
            {
              "key": "[\"apps/mfe-audit/src/app/components/DeliveryStatusPill.tsx\",\"inline-rgb\",\"border:'rgba(245,158,11,0.45)\"]",
              "count": 1
            },
            {
              "key": "[\"apps/mfe-audit/src/app/components/DeliveryStatusPill.tsx\",\"inline-rgb\",\"border:'rgba(34,197,94,0.4)\"]",
              "count": 1
            },
            {
              "key": "[\"apps/mfe-audit/src/app/components/DeliveryStatusPill.tsx\",\"inline-rgb\",\"border:'rgba(59,130,246,0.4)\"]",
              "count": 1
            },
            {
              "key": "[\"apps/mfe-reporting/src/modules/hr-demographic-report/utils/location-to-geomap.ts\",\"inline-hex\",\"color:'#dc2626'\"]",
              "count": 1
            },
            {
              "key": "[\"apps/mfe-shell/src/app/RootErrorBoundary.tsx\",\"inline-hex\",\"background:'#e5e7eb'\"]",
              "count": 1
            },
            {
              "key": "[\"apps/mfe-shell/src/app/RootErrorBoundary.tsx\",\"inline-hex\",\"background:'#fef2f2'\"]",
              "count": 1
            },
            {
              "key": "[\"apps/mfe-shell/src/app/RootErrorBoundary.tsx\",\"inline-hex\",\"background:'#fff'\"]",
              "count": 1
            },
            {
              "key": "[\"apps/mfe-shell/src/app/RootErrorBoundary.tsx\",\"inline-hex\",\"color:'#1f2937'\"]",
              "count": 1
            },
            {
              "key": "[\"apps/mfe-shell/src/app/RootErrorBoundary.tsx\",\"inline-hex\",\"color:'#b91c1c'\"]",
              "count": 1
            },
            {
              "key": "[\"packages/x-charts/src/Bar3DChart.tsx\",\"inline-hex\",\"color:'#ffd166'\"]",
              "count": 1
            },
            {
              "key": "[\"packages/x-charts/src/CalendarHeatmap.tsx\",\"inline-hex\",\"bordercolor:'#333'\"]",
              "count": 1
            },
            {
              "key": "[\"packages/x-charts/src/GaugeChart.tsx\",\"inline-hex\",\"color:'#999'\"]",
              "count": 1
            },
            {
              "key": "[\"packages/x-charts/src/GeoMap.tsx\",\"inline-hex\",\"bordercolor:'#000'\"]",
              "count": 1
            },
            {
              "key": "[\"packages/x-charts/src/GeoMap.tsx\",\"inline-hex\",\"bordercolor:'#cbd5e1'\"]",
              "count": 1
            },
            {
              "key": "[\"packages/x-charts/src/HeatmapChart.tsx\",\"inline-hex\",\"bordercolor:'#333'\"]",
              "count": 1
            },
            {
              "key": "[\"packages/x-charts/src/RadarChart.tsx\",\"inline-rgb\",\"color:'rgba(0,0,0,0.1)\"]",
              "count": 1
            },
            {
              "key": "[\"packages/x-charts/src/TreemapChart.tsx\",\"inline-hex\",\"bordercolor:'#333'\"]",
              "count": 1
            },
            {
              "key": "[\"packages/x-charts/src/TreemapChart.tsx\",\"inline-hex\",\"bordercolor:'#fff'\"]",
              "count": 1
            },
            {
              "key": "[\"packages/x-charts/src/TreemapChart.tsx\",\"inline-hex\",\"color:'#333'\"]",
              "count": 1
            },
            {
              "key": "[\"packages/x-charts/src/WaterfallChart.tsx\",\"inline-hex\",\"color:'#94a3b8'\"]",
              "count": 1
            },
            {
              "key": "[\"packages/x-charts/src/collaboration/chart-export.ts\",\"inline-hex\",\"backgroundcolor:'#ffffff'\"]",
              "count": 1
            },
            {
              "key": "[\"packages/x-charts/src/states/ChartErrorState.tsx\",\"inline-hex\",\"color:\\\"#fff\\\"\"]",
              "count": 1
            },
            {
              "key": "[\"packages/x-charts/src/theme/DesignLabEChartsPrintTheme.ts\",\"inline-hex\",\"backgroundcolor:'#ffffff'\"]",
              "count": 1
            },
            {
              "key": "[\"packages/x-charts/src/theme/DesignLabEChartsPrintTheme.ts\",\"inline-hex\",\"bordercolor:'#ffffff'\"]",
              "count": 1
            },
            {
              "key": "[\"packages/x-charts/src/theme/DesignLabEChartsPrintTheme.ts\",\"inline-rgb\",\"color:'rgba(0,0,0,0.25)\"]",
              "count": 1
            },
            {
              "key": "[\"packages/x-charts/src/theme/decal-patterns.ts\",\"inline-rgb\",\"color:'rgba(0,0,0,0.1)\"]",
              "count": 1
            },
            {
              "key": "[\"packages/x-charts/src/theme/decal-patterns.ts\",\"inline-rgb\",\"color:'rgba(0,0,0,0.12)\"]",
              "count": 1
            },
            {
              "key": "[\"packages/x-charts/src/theme/decal-patterns.ts\",\"inline-rgb\",\"color:'rgba(0,0,0,0.15)\"]",
              "count": 1
            }
          ]
        }
      }
    },
    "palette-over-token": {
      "measurementVersion": 1,
      "observedStatus": "fail",
      "dimensions": {
        "internal": {
          "direction": "lower-is-better",
          "value": 36,
          "items": [
            {
              "key": "[\"apps/mfe-shell/src/pages/admin/design-lab/pages/ChartsListing.tsx\",\"bg-amber-100\"]",
              "count": 1
            },
            {
              "key": "[\"apps/mfe-shell/src/pages/admin/design-lab/pages/ChartsListing.tsx\",\"bg-blue-100\"]",
              "count": 1
            },
            {
              "key": "[\"apps/mfe-shell/src/pages/admin/design-lab/pages/ChartsListing.tsx\",\"bg-gray-100\"]",
              "count": 1
            },
            {
              "key": "[\"apps/mfe-shell/src/pages/admin/design-lab/pages/ChartsListing.tsx\",\"bg-green-100\"]",
              "count": 1
            },
            {
              "key": "[\"apps/mfe-shell/src/pages/admin/design-lab/pages/ChartsListing.tsx\",\"bg-purple-100\"]",
              "count": 1
            },
            {
              "key": "[\"apps/mfe-shell/src/pages/admin/design-lab/pages/ChartsListing.tsx\",\"bg-rose-100\"]",
              "count": 1
            },
            {
              "key": "[\"apps/mfe-shell/src/pages/admin/design-lab/pages/ChartsListing.tsx\",\"text-amber-700\"]",
              "count": 1
            },
            {
              "key": "[\"apps/mfe-shell/src/pages/admin/design-lab/pages/ChartsListing.tsx\",\"text-blue-700\"]",
              "count": 1
            },
            {
              "key": "[\"apps/mfe-shell/src/pages/admin/design-lab/pages/ChartsListing.tsx\",\"text-gray-600\"]",
              "count": 1
            },
            {
              "key": "[\"apps/mfe-shell/src/pages/admin/design-lab/pages/ChartsListing.tsx\",\"text-green-700\"]",
              "count": 1
            },
            {
              "key": "[\"apps/mfe-shell/src/pages/admin/design-lab/pages/ChartsListing.tsx\",\"text-purple-700\"]",
              "count": 1
            },
            {
              "key": "[\"apps/mfe-shell/src/pages/admin/design-lab/pages/ChartsListing.tsx\",\"text-rose-700\"]",
              "count": 1
            },
            {
              "key": "[\"apps/mfe-shell/src/pages/admin/design-lab/showcase/PermissionGatesShowcase.tsx\",\"bg-blue-50\"]",
              "count": 1
            },
            {
              "key": "[\"apps/mfe-shell/src/pages/admin/design-lab/showcase/PermissionGatesShowcase.tsx\",\"bg-blue-500\"]",
              "count": 1
            },
            {
              "key": "[\"apps/mfe-shell/src/pages/admin/design-lab/showcase/PermissionGatesShowcase.tsx\",\"bg-gray-100\"]",
              "count": 1
            },
            {
              "key": "[\"apps/mfe-shell/src/pages/admin/design-lab/showcase/PermissionGatesShowcase.tsx\",\"bg-gray-50\"]",
              "count": 2
            },
            {
              "key": "[\"apps/mfe-shell/src/pages/admin/design-lab/showcase/PermissionGatesShowcase.tsx\",\"bg-green-100\"]",
              "count": 1
            },
            {
              "key": "[\"apps/mfe-shell/src/pages/admin/design-lab/showcase/PermissionGatesShowcase.tsx\",\"bg-red-100\"]",
              "count": 1
            },
            {
              "key": "[\"apps/mfe-shell/src/pages/admin/design-lab/showcase/PermissionGatesShowcase.tsx\",\"bg-yellow-100\"]",
              "count": 1
            },
            {
              "key": "[\"apps/mfe-shell/src/pages/admin/design-lab/showcase/PermissionGatesShowcase.tsx\",\"border-gray-300\"]",
              "count": 1
            },
            {
              "key": "[\"apps/mfe-shell/src/pages/admin/design-lab/showcase/PermissionGatesShowcase.tsx\",\"border-green-300\"]",
              "count": 1
            },
            {
              "key": "[\"apps/mfe-shell/src/pages/admin/design-lab/showcase/PermissionGatesShowcase.tsx\",\"border-red-300\"]",
              "count": 1
            },
            {
              "key": "[\"apps/mfe-shell/src/pages/admin/design-lab/showcase/PermissionGatesShowcase.tsx\",\"border-yellow-300\"]",
              "count": 1
            },
            {
              "key": "[\"apps/mfe-shell/src/pages/admin/design-lab/showcase/PermissionGatesShowcase.tsx\",\"text-blue-400\"]",
              "count": 1
            },
            {